,cod_category,category
505,506,Best Rhythm & Blues Song
506,507,"Best Rhythm & Blues Vocal Performance, Female"
507,508,"Best Rhythm & Blues Vocal Performance, Male"
508,509,Best Rock & Roll Recording
509,510,Best Rock Album
510,511,Best Rock Gospel Album
511,512,Best Rock Instrumental Performance
512,513,"Best Rock Instrumental Performance (Orchestra, Group Or Soloist)"
513,514,Best Rock Or Rap Gospel Album
514,515,Best Rock Performance
515,516,Best Rock Performance By A Duo Or Group With Vocal
516,517,Best Rock Performance By A Duo Or Group With Vocals
517,518,Best Rock Song
518,519,Best Rock Vocal Performance By A Duo Or Group
519,520,"Best Rock Vocal Performance, Female"
520,521,"Best Rock Vocal Performance, Male"
521,522,"Best Rock Vocal Performance, Solo"
522,523,Best Rock/Contemporary Gospel Album
523,524,Best Roots Gospel Album
524,525,Best Sacred Performance
525,526,Best Sacred Performance (Musical)
526,527,Best Sacred Performance (Non-Classical)
527,528,Best Sacred Recording (Musical)
528,529,Best Salsa Album
529,530,Best Salsa Performance
530,531,Best Salsa/Merengue Album
531,532,Best Score From An Original Cast Show Album
532,533,Best Score From The Original Cast Show Album
533,534,"Best Score Soundtrack Album For A Motion Picture, Television Or Other Visual Media"
534,535,"Best Score Soundtrack Album For Motion Picture, Television Or Other Visual Media"
535,536,Best Score Soundtrack For Visual Media
536,537,Best Short Form Music Video
537,538,Best Show Album (Original Cast)
538,539,Best Small Ensemble Performance
539,540,Best Small Ensemble Performance (With Or Without Conductor)
540,541,Best Small Ensemble Performance (with or without Conductor)
541,542,Best Solo Rock Vocal Performance
542,543,"Best Solo Vocal Performance, Female"
543,544,"Best Solo Vocal Performance, Male"
544,545,Best Song Written For A Motion Picture Or For Television
545,546,"Best Song Written For A Motion Picture, Television Or Other Visual Media"
546,547,"Best Song Written For A Motion Picture, Television Or Other Visual Media."
547,548,"Best Song Written For Motion Picture, Television Or Other Visual Media"
548,549,Best Song Written For Visual Media
549,550,Best Song Written Specifically For A Motion Picture Or For Television
550,551,Best Song Written Specifically For A Motion Picture Or Television
551,552,Best Soul Gospel Performance
552,553,Best Soul Gospel Performance By A Duo Or Group
553,554,"Best Soul Gospel Performance By A Duo, Group, Choir Or Chorus"
554,555,"Best Soul Gospel Performance, Contemporary"
555,556,"Best Soul Gospel Performance, Female"
556,557,"Best Soul Gospel Performance, Male"
557,558,"Best Soul Gospel Performance, Traditional"
558,559,"Best Soul Gospel Vocal Performance Duo, Group, Choir Or Chorus"
559,560,"Best Soul Gospel Vocal Performance, Male Or Female"
560,561,Best Sound Track Album - Background Score From A Motion Picture Or Television
561,562,Best Sound Track Album Or Recording Of Music Score From Motion Picture Or Television
562,563,Best Sound Track Album Or Recording Of Original Cast From A Motion Picture Or Television
563,564,Best Sound Track Album Or Recording Of Original Cast From Motion Picture Or Television
564,565,Best Sound Track Album Or Recording Of Score From Motion Picture Or Television
565,566,"Best Sound Track Album, Dramatic Picture Score Or Original Cast"
566,567,"Best Sound Track Album, Original Cast - Motion Picture Or Television"
567,568,Best Soundtrack Album
568,569,Best Southern Gospel Album
569,570,"Best Southern Gospel, Country Gospel Or Bluegrass Gospel Album"
570,571,"Best Southern, Country Or Bluegrass Gospel Album"
571,572,"Best Southern, Country, Or Bluegrass Gospel Album"
572,573,"Best Southern, Country, or Bluegrass Gospel Album"
573,574,Best Spoken Comedy Album
574,575,Best Spoken Word Album
575,576,"Best Spoken Word Album (Includes Poetry, Audio Books & Story Telling)"
576,577,"Best Spoken Word Album (Includes Poetry, Audio Books & Storytelling)"
577,578,Best Spoken Word Album For Children
578,579,Best Spoken Word Album for Children
579,580,Best Spoken Word Or Drama Recording
580,581,Best Spoken Word Or Non-Musical Album
581,582,Best Spoken Word Or Non-Musical Recording
582,583,Best Spoken Word Recording
583,584,"Best Spoken Word, Documentary Or Drama"
584,585,"Best Spoken Word, Documentary Or Drama Recording"
585,586,Best Surround Sound Album
586,587,Best Tejano Album
587,588,Best Tejano Music Performance
588,589,Best Tejano Performance
589,590,Best Traditional Blues Album
590,591,Best Traditional Blues Recording
591,592,Best Traditional Folk Album
592,593,Best Traditional Folk Recording
593,594,Best Traditional Gospel Album
594,595,Best Traditional Pop Performance
595,596,Best Traditional Pop Vocal Album
596,597,Best Traditional Pop Vocal Performance
597,598,Best Traditional R&B Performance
598,599,Best Traditional R&B Vocal Album
599,600,Best Traditional R&B Vocal Performance
600,601,Best Traditional Soul Gospel Album
601,602,Best Traditional Soul Gospel Performance
602,603,Best Traditional Tropical Latin Album
603,604,Best Traditional Tropical Latin Performance
604,605,Best Traditional World Music Album
605,606,Best Tropical Latin Album
606,607,Best Tropical Latin Performance
607,608,Best Urban Contemporary Album
608,609,Best Urban/Alternative Performance
609,610,Best Video Album
610,611,"Best Video, Short Form"
611,612,Best Vocal Arrangement For Two Or More Voices
612,613,"Best Vocal Performance Album, Female"
613,614,"Best Vocal Performance Album, Male"
614,615,"Best Vocal Performance Single Record Or Track, Female"
615,616,"Best Vocal Performance Single Record Or Track, Male"
616,617,"Best Vocal Performance, Female"
617,618,"Best Vocal Performance, Male"
618,619,Best Vocal Soloist Performance
619,620,Best Vocal Soloist Performance (With Or Without Orchestra)
620,621,"Best Vocal Soloist Performance, Classical"
621,622,Best World Music Album
622,623,Best Zydeco Or Cajun Music Album
623,624,Classical Album Of The Year
624,625,Classical Producer Of The Year
625,626,Most Promising New Classical Recording Artist
626,627,Producer Of The Year
627,628,Producer Of The Year (Non Classical)
628,629,Producer Of The Year (Non-Classical)
629,630,"Producer Of The Year, (Non Classical)"
630,631,"Producer Of The Year, Classical"
631,632,"Producer Of The Year, Non-Classical"
632,633,Record Of The Year
633,634,"Remixer Of The Year, Non-Classical"
634,635,"Remixer Of The Year, Non-classical"
635,636,"Remixer of the Year, Non-Classical"
636,637,Song Of The Year
637,638,Video Of The Year
